{
  "iss": "https://sts.example.com",
  "sub": "user-1",
  "aud": "resource://api",
  "exp": 1790000300,
  "iat": 1790000000,
  "jti": "018f7d6a-8f4a-7d9f-9a54-5e4fd7df0001",
  "zone_id": "zone-1",
  "client_id": "app-1",
  "scope": "read write",
  "sid": "sid-1",
  "root_sid": "root-sid-1",
  "use": "resource",
  "sub_type": "user",
  "target": ["resource://api"],
  "agent_session_id": "agent-session-1",
  "delegation_edge_id": "edge-1",
  "source_session_id": "sid-parent",
  "target_session_id": "sid-child",
  "delegation_path": ["edge-root", "edge-1"],
  "delegation_chain": [
    {
      "application_id": "app-parent",
      "agent_session_id": "agent-parent",
      "delegation_edge_id": "edge-root"
    }
  ],
  "hop_count": 1,
  "delegation_graph_epoch": 7
}
